{
  "collection_run_id": "run_manual_review_20260805_000001",
  "source_id": "district",
  "collector_name": "manual_source_review",
  "collector_version": "0.1.0",
  "git_commit_sha": "c418ca0325f806a0089097c12c5dd93043b5808c",
  "started_at": "2026-08-05T12:00:00-04:00",
  "completed_at": "2026-08-05T12:05:00-04:00",
  "run_status": "skipped",
  "requested_count": 0,
  "successful_count": 0,
  "failed_count": 0,
  "skipped_count": 1,
  "duplicate_count": 0,
  "bytes_collected": 0,
  "rate_limit_events": 0,
  "failure_summary": null,
  "approved_collection_scope": {
    "collection_decision": "pending_review",
    "permitted_use_scope": "limited_manual_feasibility_observation_only",
    "permitted_fields": [
      "source identity",
      "public URL structure observations",
      "high-level field availability notes"
    ],
    "prohibited_fields": [
      "protected event descriptions",
      "images",
      "copied listing content",
      "personal data"
    ],
    "maximum_request_frequency": "manual_review_only"
  },
  "city_scope": [
    "Bengaluru",
    "Hyderabad"
  ],
  "category_scope": [
    "Cooking and Baking",
    "Art and Painting",
    "Pottery and Ceramics",
    "Coffee Making"
  ],
  "initiated_by": "Codex",
  "environment_name": "local"
}
